{"capabilities":[{"category":"agent.session","coverage":"full","evidence":["agent.session_end","agent.session_start"],"limitations":["Session lifecycle timing is derived around the native conversation."],"state":"derived","timing":"derived"},{"category":"model.turn","coverage":"partial","evidence":["model.turn_end","model.turn_start"],"limitations":["Model turns are derived from observable agent-loop boundaries; the exact provider request boundary is not exposed."],"state":"derived","timing":"derived"},{"category":"provider.exchange","coverage":"none","evidence":[],"limitations":["Completion logs are available only when OpenHands completion logging is enabled."],"state":"disabled","timing":"not_applicable"},{"category":"tool.invocation","coverage":"full","evidence":["delegation.start","file.patch","file.read","shell.start","tool.start"],"limitations":[],"state":"captured","timing":"not_available"},{"category":"tool.result","coverage":"full","evidence":["delegation.end","file.patch","file.read","shell.end","tool.end","tool.rejected","tool.result"],"limitations":[],"state":"captured","timing":"not_available"},{"category":"tool.timing","coverage":"full","evidence":["delegation.end","file.patch","file.read","shell.end","tool.end"],"limitations":[],"state":"derived","timing":"derived"},{"category":"shell","coverage":"full","evidence":["shell.end","shell.start"],"limitations":[],"state":"captured","timing":"derived"},{"category":"file","coverage":"full","evidence":["file.patch","file.read"],"limitations":[],"state":"captured","timing":"derived"},{"category":"search","coverage":"none","evidence":[],"limitations":[],"state":"not_observed","timing":"not_available"},{"category":"browser","coverage":"none","evidence":[],"limitations":[],"state":"disabled","timing":"not_applicable"},{"category":"delegation","coverage":"partial","evidence":["delegation.end","delegation.start"],"limitations":["The durable child conversation source was read, but one or more delegations could not be linked to complete child evidence."],"state":"captured","timing":"derived"},{"category":"context.compaction","coverage":"none","evidence":[],"limitations":[],"state":"not_observed","timing":"not_available"},{"category":"memory","coverage":"none","evidence":[],"limitations":[],"state":"not_exposed","timing":"not_available"},{"category":"harness.lifecycle","coverage":"full","evidence":["harness.shutdown_end","harness.shutdown_start","harness.startup_end","harness.startup_start"],"limitations":["Startup and shutdown are coarse harness-owned phases; benchmark-specific infrastructure is intentionally not subdivided."],"state":"derived","timing":"derived"},{"category":"container.lifecycle","coverage":"none","evidence":[],"limitations":["Harbor exposes task-container identity and image metadata, not operating-system activity below agent tools."],"state":"not_exposed","timing":"not_available"},{"category":"evaluator.lifecycle","coverage":"none","evidence":[],"limitations":["Evaluator lifecycle is reported only when the outer harness makes its boundaries observable to the framework adapter."],"state":"not_exposed","timing":"not_available"},{"category":"patch","coverage":"none","evidence":[],"limitations":[],"state":"not_observed","timing":"not_available"},{"category":"native.evidence","coverage":"partial","evidence":["agent.error","agent.interrupt","agent.message","agent.state_update","agent.system_prompt","delegation.end","delegation.start","file.patch","file.read","model.turn_end","shell.end","shell.start","tool.end","tool.rejected","tool.result","tool.start"],"limitations":["Token ID events and token or cost accounting fields are intentionally excluded.","The durable child conversation source was read, but child evidence was incomplete or could not all be linked."],"state":"captured","timing":"native_wall"}],"framework":"openhands","generated_at":"2026-07-28T05:52:17.220Z","schema_digest":"c54f3134f6d71167a7af3647f729a706dc5677edac914b89860a2a50c1d32d9a","schema_version":"benchmark-trace/v1","trace_id":"trace-08c796d04d2c4c7f955701e7bf842ef5"}
