{"capabilities":[{"category":"agent.session","coverage":"full","evidence":["agent.session_end","agent.session_start"],"limitations":["Session lifecycle timing is derived around the native conversation."],"state":"derived","timing":"derived"},{"category":"model.turn","coverage":"partial","evidence":["model.turn_end","model.turn_start"],"limitations":["Model turns are derived from observable agent-loop boundaries; the exact provider request boundary is not exposed."],"state":"derived","timing":"derived"},{"category":"provider.exchange","coverage":"none","evidence":[],"limitations":["Completion logs are available only when OpenHands completion logging is enabled."],"state":"disabled","timing":"not_applicable"},{"category":"tool.invocation","coverage":"full","evidence":["file.read","shell.start"],"limitations":[],"state":"captured","timing":"not_available"},{"category":"tool.result","coverage":"full","evidence":["file.read","shell.end"],"limitations":[],"state":"captured","timing":"not_available"},{"category":"tool.timing","coverage":"full","evidence":["file.read","shell.end"],"limitations":[],"state":"derived","timing":"derived"},{"category":"shell","coverage":"full","evidence":["shell.end","shell.start"],"limitations":[],"state":"captured","timing":"derived"},{"category":"file","coverage":"full","evidence":["file.read"],"limitations":[],"state":"captured","timing":"derived"},{"category":"search","coverage":"none","evidence":[],"limitations":[],"state":"not_observed","timing":"not_available"},{"category":"browser","coverage":"none","evidence":[],"limitations":[],"state":"disabled","timing":"not_applicable"},{"category":"delegation","coverage":"none","evidence":[],"limitations":[],"state":"disabled","timing":"not_applicable"},{"category":"context.compaction","coverage":"none","evidence":[],"limitations":[],"state":"not_observed","timing":"not_available"},{"category":"memory","coverage":"none","evidence":[],"limitations":[],"state":"not_exposed","timing":"not_available"},{"category":"harness.lifecycle","coverage":"full","evidence":["harness.shutdown_end","harness.shutdown_start","harness.startup_end","harness.startup_start"],"limitations":["Startup and shutdown are coarse harness-owned phases; benchmark-specific infrastructure is intentionally not subdivided."],"state":"derived","timing":"derived"},{"category":"container.lifecycle","coverage":"none","evidence":[],"limitations":["Harbor exposes task-container identity and image metadata, not operating-system activity below agent tools."],"state":"not_exposed","timing":"not_available"},{"category":"evaluator.lifecycle","coverage":"none","evidence":[],"limitations":["Evaluator lifecycle is reported only when the outer harness makes its boundaries observable to the framework adapter."],"state":"not_exposed","timing":"not_available"},{"category":"patch","coverage":"none","evidence":[],"limitations":[],"state":"not_observed","timing":"not_available"},{"category":"native.evidence","coverage":"full","evidence":["agent.message","agent.state_update","agent.system_prompt","file.read","model.turn_end","shell.end","shell.start"],"limitations":["Token ID events and token or cost accounting fields are intentionally excluded."],"state":"captured","timing":"native_wall"}],"framework":"openhands","generated_at":"2026-08-10T22:34:44.727Z","schema_digest":"c54f3134f6d71167a7af3647f729a706dc5677edac914b89860a2a50c1d32d9a","schema_version":"benchmark-trace/v1","trace_id":"trace-df0b528bf5ee4467a28120d579532919"}
