{"capabilities":[{"category":"agent.session","coverage":"none","evidence":[],"limitations":["Session lifecycle timing is derived around the native conversation."],"state":"not_observed","timing":"not_available"},{"category":"model.turn","coverage":"none","evidence":[],"limitations":["Model turns are derived from observable agent-loop boundaries; the exact provider request boundary is not exposed."],"state":"not_observed","timing":"not_available"},{"category":"provider.exchange","coverage":"none","evidence":[],"limitations":["Completion logs are available only when OpenHands completion logging is enabled."],"state":"disabled","timing":"not_applicable"},{"category":"tool.invocation","coverage":"none","evidence":[],"limitations":[],"state":"not_observed","timing":"not_available"},{"category":"tool.result","coverage":"none","evidence":[],"limitations":[],"state":"not_observed","timing":"not_available"},{"category":"tool.timing","coverage":"none","evidence":[],"limitations":[],"state":"not_observed","timing":"not_available"},{"category":"shell","coverage":"none","evidence":[],"limitations":[],"state":"not_observed","timing":"not_available"},{"category":"file","coverage":"none","evidence":[],"limitations":[],"state":"not_observed","timing":"not_available"},{"category":"search","coverage":"none","evidence":[],"limitations":[],"state":"not_observed","timing":"not_available"},{"category":"browser","coverage":"none","evidence":[],"limitations":[],"state":"disabled","timing":"not_applicable"},{"category":"delegation","coverage":"none","evidence":[],"limitations":[],"state":"disabled","timing":"not_applicable"},{"category":"context.compaction","coverage":"none","evidence":[],"limitations":[],"state":"disabled","timing":"not_applicable"},{"category":"memory","coverage":"none","evidence":[],"limitations":[],"state":"not_exposed","timing":"not_available"},{"category":"harness.lifecycle","coverage":"none","evidence":[],"limitations":["Startup and shutdown are coarse harness-owned phases; benchmark-specific infrastructure is intentionally not subdivided."],"state":"not_observed","timing":"not_available"},{"category":"container.lifecycle","coverage":"none","evidence":[],"limitations":["Harbor exposes task-container identity and image metadata, not operating-system activity below agent tools."],"state":"not_observed","timing":"not_available"},{"category":"evaluator.lifecycle","coverage":"none","evidence":[],"limitations":["Evaluator lifecycle is reported only when the outer harness makes its boundaries observable to the framework adapter."],"state":"not_exposed","timing":"not_available"},{"category":"patch","coverage":"none","evidence":[],"limitations":[],"state":"not_observed","timing":"not_available"},{"category":"native.evidence","coverage":"none","evidence":[],"limitations":["Token ID events and token or cost accounting fields are intentionally excluded."],"state":"not_observed","timing":"not_available"}],"framework":"openhands","generated_at":"2026-08-10T23:14:38.232Z","schema_digest":"c54f3134f6d71167a7af3647f729a706dc5677edac914b89860a2a50c1d32d9a","schema_version":"benchmark-trace/v1","trace_id":"trace-5c179851f34949e6834176638b5feacd"}
