{"capabilities":[{"category":"agent.session","coverage":"full","evidence":["agent.session_end","agent.session_start"],"limitations":["Session lifecycle timing is derived around the native conversation."],"state":"derived","timing":"derived"},{"category":"model.turn","coverage":"partial","evidence":["model.turn_end","model.turn_start"],"limitations":["Model turns are derived from observable agent-loop boundaries; the exact provider request boundary is not exposed."],"state":"derived","timing":"derived"},{"category":"provider.exchange","coverage":"none","evidence":[],"limitations":["Completion logs are available only when OpenHands completion logging is enabled."],"state":"disabled","timing":"not_applicable"},{"category":"tool.invocation","coverage":"full","evidence":["delegation.start","file.patch","file.read","shell.start","tool.start"],"limitations":[],"state":"captured","timing":"not_available"},{"category":"tool.result","coverage":"full","evidence":["delegation.end","file.patch","file.read","shell.end","tool.end"],"limitations":[],"state":"captured","timing":"not_available"},{"category":"tool.timing","coverage":"full","evidence":["delegation.end","file.patch","file.read","shell.end","tool.end"],"limitations":[],"state":"derived","timing":"derived"},{"category":"shell","coverage":"full","evidence":["shell.end","shell.start"],"limitations":[],"state":"captured","timing":"derived"},{"category":"file","coverage":"full","evidence":["file.patch","file.read"],"limitations":[],"state":"captured","timing":"derived"},{"category":"search","coverage":"none","evidence":[],"limitations":[],"state":"not_observed","timing":"not_available"},{"category":"browser","coverage":"none","evidence":[],"limitations":[],"state":"disabled","timing":"not_applicable"},{"category":"delegation","coverage":"full","evidence":["delegation.end","delegation.start"],"limitations":["Child events are recovered at attempt finalization from the agent-server's durable conversation archive; occurred_at keeps source time while recorded_at reflects archival ingestion."],"state":"captured","timing":"derived"},{"category":"context.compaction","coverage":"none","evidence":[],"limitations":[],"state":"disabled","timing":"not_applicable"},{"category":"memory","coverage":"none","evidence":[],"limitations":[],"state":"not_exposed","timing":"not_available"},{"category":"harness.lifecycle","coverage":"full","evidence":["harness.shutdown_end","harness.shutdown_start","harness.startup_end","harness.startup_start"],"limitations":["Startup and shutdown are coarse harness-owned phases; benchmark-specific infrastructure is intentionally not subdivided."],"state":"derived","timing":"derived"},{"category":"container.lifecycle","coverage":"metadata_only","evidence":["container.observed"],"limitations":["Harbor exposes task-container identity and image metadata, not operating-system activity below agent tools."],"state":"captured","timing":"native_wall"},{"category":"evaluator.lifecycle","coverage":"none","evidence":[],"limitations":["Evaluator lifecycle is reported only when the outer harness makes its boundaries observable to the framework adapter."],"state":"not_exposed","timing":"not_available"},{"category":"patch","coverage":"none","evidence":[],"limitations":[],"state":"not_observed","timing":"not_available"},{"category":"native.evidence","coverage":"full","evidence":["agent.error","agent.message","agent.system_prompt","delegation.end","delegation.start","file.patch","file.read","model.turn_end","shell.end","shell.start","tool.end","tool.start"],"limitations":["Token ID events and token or cost accounting fields are intentionally excluded.","Internal remote subagent events were recovered from the agent-server's durable conversation archive."],"state":"captured","timing":"native_wall"}],"framework":"openhands","generated_at":"2026-07-28T01:02:33.316Z","schema_digest":"c54f3134f6d71167a7af3647f729a706dc5677edac914b89860a2a50c1d32d9a","schema_version":"benchmark-trace/v1","trace_id":"trace-ca1411a91ea0470f83d08296e0ce97a8"}
